{
  "$schema": "https://json-schema.org/draft/2020-12/schema",
  "$id": "https://github.com/Ornn8/bside-olivia-community/blob/main/contracts/video_capability_manifest.schema.json",
  "title": "BSide Olivia video capability BOM",
  "type": "object",
  "additionalProperties": false,
  "required": ["schema_version", "version", "bundles"],
  "properties": {
    "schema_version": {"const": "olivia.video-capability-bom.v1"},
    "version": {"type": "string", "minLength": 1},
    "provenance": {"type": "object"},
    "bundles": {
      "type": "array",
      "minItems": 2,
      "items": {"$ref": "#/$defs/bundle"}
    }
  },
  "$defs": {
    "relativePath": {
      "type": "string",
      "pattern": "^(?!/)(?!.*//)(?!.*(?:/$|\\\\))(?!.*[:<>\"|?*])(?!.*(?:^|/)(?:[Cc][Oo][Nn]|[Pp][Rr][Nn]|[Aa][Uu][Xx]|[Nn][Uu][Ll]|[Cc][Oo][Mm][1-9]|[Ll][Pp][Tt][1-9])(?:\\.|/|$))(?!.*(?:^|/)\\.\\.?(?:/|$))(?!.*[ .](?:/|$)).+$"
    },
    "bundle": {
      "type": "object",
      "additionalProperties": false,
      "required": ["id", "label", "status", "requires_gpu", "dependencies", "files"],
      "properties": {
        "id": {"enum": ["ordinary_video", "music_video"]},
        "label": {"type": "string"},
        "status": {"const": "FIXED"},
        "requires_gpu": {"type": "boolean"},
        "license_review_required": {"type": "boolean"},
        "runtime_environment": {
          "type": "object",
          "propertyNames": {
            "enum": [
              "OLIVIA_COSYVOICE_PYTHON",
              "OLIVIA_BREEZE_TTS_ROOT",
              "OLIVIA_BREEZE_TTS_PYTHON",
              "OLIVIA_BREEZE_TTS_MODEL_ROOT",
              "OLIVIA_BREEZE_TTS_MODEL_LICENSE",
              "OLIVIA_FFMPEG_EXE",
              "OLIVIA_LATENTSYNC_PYTHON",
              "OLIVIA_LATENTSYNC_ROOT",
              "OLIVIA_ORDINARY_ACTION_BASE",
              "OLIVIA_MUSIC_PERFORMANCE_BASE",
              "OLIVIA_OFFICIAL_REPLY_REFERENCE",
              "OLIVIA_MINIMAX_COMFY_PYTHON",
              "OLIVIA_MINIMAX_COMFY_ROOT",
              "OLIVIA_MINIMAX_WORKER",
              "OLIVIA_ROFORMER_EXE",
              "OLIVIA_ROFORMER_PYTHON",
              "OLIVIA_ROFORMER_MODEL_PATH",
              "OLIVIA_ROFORMER_CONFIG_PATH",
              "OLIVIA_SOULX_SVC_ROOT",
              "OLIVIA_SOULX_SVC_PYTHON",
              "OLIVIA_TTS_CONFIG",
              "OLIVIA_TTS_QUALITY_GATE_CACHE_ROOT"
            ]
          },
          "additionalProperties": {"$ref": "#/$defs/relativePath"}
        },
        "runtime_patches": {
          "type": "array",
          "items": {"$ref": "#/$defs/runtimePatch"}
        },
        "runtime_artifacts": {
          "type": "array",
          "items": {"$ref": "#/$defs/runtimeArtifact"}
        },
        "dependencies": {"type": "array", "items": {"type": "string"}},
        "files": {"type": "array", "items": {"$ref": "#/$defs/file"}}
      }
    },
    "runtimePatch": {
      "type": "object",
      "additionalProperties": false,
      "required": ["id", "path", "target", "sha256"],
      "properties": {
        "id": {"type": "string", "minLength": 1},
        "path": {"$ref": "#/$defs/relativePath"},
        "target": {"$ref": "#/$defs/relativePath"},
        "sha256": {"type": "string", "pattern": "^[A-Fa-f0-9]{64}$"}
      }
    },
    "runtimeArtifact": {
      "type": "object",
      "additionalProperties": false,
      "required": ["id", "part_ids", "archive_size_bytes", "archive_sha256", "destination", "strip_components"],
      "properties": {
        "id": {"type": "string", "minLength": 1},
        "part_ids": {
          "type": "array",
          "minItems": 1,
          "uniqueItems": true,
          "items": {"type": "string", "minLength": 1}
        },
        "archive_size_bytes": {"type": "integer", "minimum": 1},
        "archive_sha256": {"type": "string", "pattern": "^[A-Fa-f0-9]{64}$"},
        "destination": {"$ref": "#/$defs/relativePath"},
        "strip_components": {"type": "integer", "minimum": 0, "maximum": 4}
      }
    },
    "file": {
      "type": "object",
      "additionalProperties": false,
      "required": ["id", "path", "size_bytes", "sha256", "license", "sources"],
      "properties": {
        "id": {"type": "string"},
        "path": {"$ref": "#/$defs/relativePath"},
        "size_bytes": {"type": "integer", "minimum": 0},
        "sha256": {"type": "string", "pattern": "^[A-Fa-f0-9]{64}$"},
        "license": {"type": "string"},
        "redistributable": {"type": "boolean"},
        "install": {
          "type": "object",
          "additionalProperties": false,
          "required": ["kind", "destination", "strip_components"],
          "properties": {
            "kind": {"const": "zip"},
            "destination": {"$ref": "#/$defs/relativePath"},
            "strip_components": {"type": "integer", "minimum": 0, "maximum": 4}
          }
        },
        "sources": {
          "type": "object",
          "propertyNames": {"enum": ["domestic", "official"]},
          "additionalProperties": {"type": "string", "format": "uri"}
        }
      }
    }
  }
}
