{
  "schema_version": "olivia.video-capability-bom.v1",
  "version": "2026.08.28",
  "provenance": {
    "policy": "assembly-only; private Olivia assets are never downloaded or redistributed",
    "cosyvoice_code": {"repo": "FunAudioLLM/CosyVoice", "revision": "074ca6dc9e80a2f424f1f74b48bdd7d3fea531cc", "license": "Apache-2.0"},
    "cosyvoice_model": {"repo": "FunAudioLLM/Fun-CosyVoice3-0.5B-2512", "modelscope_revision": "9f9c56f2514700ef79d64fd0afb693e0d672373b", "huggingface_revision": "29e01c4e8d000f4bcd70751be16fa94bf3d85a18", "file_count": 20, "size_bytes": 9747516745, "license": "Apache-2.0"},
    "latentsync_code": {"repo": "ByteDance/LatentSync", "revision": "a229c3948406bc2cf6eaf4873e662e70c6a04746", "license": "Apache-2.0", "license_url": "https://github.com/bytedance/LatentSync/blob/a229c3948406bc2cf6eaf4873e662e70c6a04746/LICENSE"},
    "latentsync_model": {"repo": "ByteDance/LatentSync-1.5", "revision": "32a20d29aead0498e3e885e90dbbe8027da1b61b", "unet_sha256": "6440b49a7ccceff56cdc001f5f17605216337f5bbd66fa360139768926e23f51", "tiny_sha256": "65147644a518d12f04e32d6f3b26facc3f8dd46e5390956a9424a650c0ce22b9", "buffalo_l_sha256": "80ffe37d8a5940d59a7384c201a2a38d4741f2f3c51eef46ebb28218a7b0ca2f", "config_path": "configs/unet/stage2_efficient.yaml", "config_resolution": 256, "config_sha256": "72e263b0adb072935a08d5cc3ce304ce5c471fab9f7e233b7304e5902bba24ce", "license": "OpenRAIL++"},
    "minimax_music3": {"repo": "Comfy-Org/MiniMax-Music-3", "revision": "6444666eb6edfb2c7fcab5f8b81da8b84b4b17b6", "license": "Apache-2.0", "license_url": "https://huggingface.co/Comfy-Org/MiniMax-Music-3/blob/6444666eb6edfb2c7fcab5f8b81da8b84b4b17b6/README.md"},
    "minimax_comfyui_code": {"repo": "Comfy-Org/ComfyUI", "revision": "a7365071e47175fb06572d0a56d1bf4116c2f581", "license": "GPL-3.0"},
    "roformer": {"repo": "openmirlab/melband-roformer-infer", "revision": "a21cb300e7637b878f46c500a68737aeb5aa2226", "model_revision": "ac9b0614ab3cd7f77219e18ba494dfd93956c348", "license": "MIT + CC-BY-NC-SA-4.0 checkpoint", "source_archive_size_bytes": 132436, "source_archive_sha256": "410c48245212667f63359c3cc915d4aaa334f52bddb3738e5cb125c3dac94f5b", "checkpoint_sha256": "87201f4d31afb5bc79993230fc49446918425574db48c01c405e44f365c7559e", "config_sha256": "5e380dfa5d5757ac4c2b7f6ef607b93d5058ecff805e7b05ed730a47b90d103c"},
    "ffmpeg": {"version": "9.0.1-essentials", "size_bytes": 111253802, "sha256": "fec81ae03971d9dd4be3ebe02e263bd2ec1d789483f931bdba5f5715e65da2e9", "source": "https://github.com/GyanD/codexffmpeg/releases/tag/9.0.1"}
  },
  "bundles": [
    {
      "id": "ordinary_video",
      "label": "普通视频",
      "status": "FIXED",
      "requires_gpu": true,
      "dependencies": ["cosyvoice", "latentsync", "ffmpeg"],
      "runtime_environment": {"OLIVIA_COSYVOICE_PYTHON": "cosyvoice/runtime/python/python.exe", "OLIVIA_FFMPEG_EXE": "ffmpeg/runtime/bin/ffmpeg.exe", "OLIVIA_LATENTSYNC_PYTHON": "latentsync/runtime/python/python.exe", "OLIVIA_LATENTSYNC_ROOT": "latentsync/runtime", "OLIVIA_TTS_CONFIG": "cosyvoice/config/tts_local.json"},
      "runtime_patches": [
        {"id":"cosyvoice-windows-audio","path":"installer/cosyvoice-windows-audio.patch.json","target":"cosyvoice/runtime/cosyvoice/utils/file_utils.py","sha256":"019a0f163e397186c0a6d26c5eeaed1c56ba88462200662950c276ceb50c2d27"},
        {"id":"latentsync-windows-memmap","path":"installer/latentsync-windows-memmap.patch.json","target":"latentsync/runtime/latentsync/pipelines/lipsync_pipeline.py","sha256":"a627cc639bd400c00466f683517afaf7adbac8b42088f128bd42e04d52b8e5b1"}
      ],
      "files": [
        {"id":"cosyvoice-code","path":"sources/CosyVoice-074ca6dc.zip","size_bytes":1633232,"sha256":"4e7b1ce909f97abcc8afa0a890f92ccf2839ff435c698d4f04a1ba7aa71a022f","license":"Apache-2.0","sources":{"domestic":"https://codeload.github.com/FunAudioLLM/CosyVoice/zip/074ca6dc9e80a2f424f1f74b48bdd7d3fea531cc","official":"https://codeload.github.com/FunAudioLLM/CosyVoice/zip/074ca6dc9e80a2f424f1f74b48bdd7d3fea531cc"},"install":{"kind":"zip","destination":"cosyvoice/runtime","strip_components":1}},
        {"id":"latentsync-code","path":"sources/LatentSync-a229c394.zip","size_bytes":8562500,"sha256":"3a1eddcd604eebc4d3b104f3f649101dbe58bb2e1c52e80cf0845c335aebcb69","license":"Apache-2.0","sources":{"official":"https://codeload.github.com/bytedance/LatentSync/zip/a229c3948406bc2cf6eaf4873e662e70c6a04746"},"install":{"kind":"zip","destination":"latentsync/runtime","strip_components":1}},
        {"id":"cosy-attributes","path":"cosyvoice/model/.gitattributes","size_bytes":1574,"sha256":"42828f8bf9e62763376589790ddf6eccc6bde9b761acd2700dc4a383ade92c33","license":"Apache-2.0","sources":{"domestic":"https://modelscope.cn/models/FunAudioLLM/Fun-CosyVoice3-0.5B-2512/resolve/9f9c56f2514700ef79d64fd0afb693e0d672373b/.gitattributes","official":"https://huggingface.co/FunAudioLLM/Fun-CosyVoice3-0.5B-2512/resolve/29e01c4e8d000f4bcd70751be16fa94bf3d85a18/.gitattributes"}},
        {"id":"cosy-blank-config","path":"cosyvoice/model/CosyVoice-BlankEN/config.json","size_bytes":659,"sha256":"168aa1bd401abc3bc262ba15ba4e499627a8b4e006e9d050b47c22de20660185","license":"Apache-2.0","sources":{"domestic":"https://modelscope.cn/models/FunAudioLLM/Fun-CosyVoice3-0.5B-2512/resolve/9f9c56f2514700ef79d64fd0afb693e0d672373b/CosyVoice-BlankEN/config.json","official":"https://huggingface.co/FunAudioLLM/Fun-CosyVoice3-0.5B-2512/resolve/29e01c4e8d000f4bcd70751be16fa94bf3d85a18/CosyVoice-BlankEN/config.json"}},
        {"id":"cosy-blank-generation","path":"cosyvoice/model/CosyVoice-BlankEN/generation_config.json","size_bytes":242,"sha256":"e558847a8b4402616f1273797b015104dc266fe4b520056fca88823ba8f8ebe6","license":"Apache-2.0","sources":{"domestic":"https://modelscope.cn/models/FunAudioLLM/Fun-CosyVoice3-0.5B-2512/resolve/9f9c56f2514700ef79d64fd0afb693e0d672373b/CosyVoice-BlankEN/generation_config.json","official":"https://huggingface.co/FunAudioLLM/Fun-CosyVoice3-0.5B-2512/resolve/29e01c4e8d000f4bcd70751be16fa94bf3d85a18/CosyVoice-BlankEN/generation_config.json"}},
        {"id":"cosy-blank-merges","path":"cosyvoice/model/CosyVoice-BlankEN/merges.txt","size_bytes":1402109,"sha256":"ac8ff86a72bee70828fbc1119bc4398c6f3a9a6e490d7b0dbe917be025478bd0","license":"Apache-2.0","sources":{"domestic":"https://modelscope.cn/models/FunAudioLLM/Fun-CosyVoice3-0.5B-2512/resolve/9f9c56f2514700ef79d64fd0afb693e0d672373b/CosyVoice-BlankEN/merges.txt","official":"https://huggingface.co/FunAudioLLM/Fun-CosyVoice3-0.5B-2512/resolve/29e01c4e8d000f4bcd70751be16fa94bf3d85a18/CosyVoice-BlankEN/merges.txt"}},
        {"id":"cosy-blank-model","path":"cosyvoice/model/CosyVoice-BlankEN/model.safetensors","size_bytes":988097824,"sha256":"130282af0dfa9fe5840737cc49a0d339d06075f83c5a315c3372c9a0740d0b96","license":"Apache-2.0","sources":{"domestic":"https://modelscope.cn/models/FunAudioLLM/Fun-CosyVoice3-0.5B-2512/resolve/9f9c56f2514700ef79d64fd0afb693e0d672373b/CosyVoice-BlankEN/model.safetensors","official":"https://huggingface.co/FunAudioLLM/Fun-CosyVoice3-0.5B-2512/resolve/29e01c4e8d000f4bcd70751be16fa94bf3d85a18/CosyVoice-BlankEN/model.safetensors"}},
        {"id":"cosy-blank-tokenizer","path":"cosyvoice/model/CosyVoice-BlankEN/tokenizer_config.json","size_bytes":1287,"sha256":"482bd979881423375ca5414e4e0d94cd7c5349dbb17fffd46b4d36d71e62a1bc","license":"Apache-2.0","sources":{"domestic":"https://modelscope.cn/models/FunAudioLLM/Fun-CosyVoice3-0.5B-2512/resolve/9f9c56f2514700ef79d64fd0afb693e0d672373b/CosyVoice-BlankEN/tokenizer_config.json","official":"https://huggingface.co/FunAudioLLM/Fun-CosyVoice3-0.5B-2512/resolve/29e01c4e8d000f4bcd70751be16fa94bf3d85a18/CosyVoice-BlankEN/tokenizer_config.json"}},
        {"id":"cosy-blank-vocab","path":"cosyvoice/model/CosyVoice-BlankEN/vocab.json","size_bytes":2776833,"sha256":"ca10d7e9fb3ed18575dd1e277a2579c16d108e32f27439684afa0e10b1440910","license":"Apache-2.0","sources":{"domestic":"https://modelscope.cn/models/FunAudioLLM/Fun-CosyVoice3-0.5B-2512/resolve/9f9c56f2514700ef79d64fd0afb693e0d672373b/CosyVoice-BlankEN/vocab.json","official":"https://huggingface.co/FunAudioLLM/Fun-CosyVoice3-0.5B-2512/resolve/29e01c4e8d000f4bcd70751be16fa94bf3d85a18/CosyVoice-BlankEN/vocab.json"}},
        {"id":"cosy-readme","path":"cosyvoice/model/README.md","size_bytes":11982,"sha256":"d4ec0fe1342b60a424ce1cd8971c670d26be38068a96148bcb6a1b8a334c3088","license":"Apache-2.0","sources":{"domestic":"https://modelscope.cn/models/FunAudioLLM/Fun-CosyVoice3-0.5B-2512/resolve/9f9c56f2514700ef79d64fd0afb693e0d672373b/README.md","official":"https://huggingface.co/FunAudioLLM/Fun-CosyVoice3-0.5B-2512/resolve/29e01c4e8d000f4bcd70751be16fa94bf3d85a18/README.md"}},
        {"id":"cosy-asset","path":"cosyvoice/model/asset/dingding.png","size_bytes":122824,"sha256":"7f04815e2e676d31b089af6fa270135f3214f2193d5e0ad98b491d007d48f1c6","license":"Apache-2.0","sources":{"domestic":"https://modelscope.cn/models/FunAudioLLM/Fun-CosyVoice3-0.5B-2512/resolve/9f9c56f2514700ef79d64fd0afb693e0d672373b/asset/dingding.png","official":"https://huggingface.co/FunAudioLLM/Fun-CosyVoice3-0.5B-2512/resolve/29e01c4e8d000f4bcd70751be16fa94bf3d85a18/asset/dingding.png"}},
        {"id":"cosy-campplus","path":"cosyvoice/model/campplus.onnx","size_bytes":28303423,"sha256":"a6ac6a63997761ae2997373e2ee1c47040854b4b759ea41ec48e4e42df0f4d73","license":"Apache-2.0","sources":{"domestic":"https://modelscope.cn/models/FunAudioLLM/Fun-CosyVoice3-0.5B-2512/resolve/9f9c56f2514700ef79d64fd0afb693e0d672373b/campplus.onnx","official":"https://huggingface.co/FunAudioLLM/Fun-CosyVoice3-0.5B-2512/resolve/29e01c4e8d000f4bcd70751be16fa94bf3d85a18/campplus.onnx"}},